{
  "$schema": "./routes.schema.json",
  "schema_version": 1,
  "catalog_date": "2026-09-03",
  "catalog_scope": {
    "definition": "Decision-relevant FA4 controls, paper routes, implementation precursors, numerical ablations, and fail-closed experiments. A catalog entry proves source availability and states the strongest evidence boundary; it does not promote a diagnostic into a training recipe. Uncatalogued intermediate native-backward revisions are accounted for by release/legacy_backward_makefiles.txt.",
    "source_epochs": [
      "The non-causal Direct-P routes use the claim-exact cfc06dad snapshot under reproduction/snapshots/forward_cfc06dad; that snapshot also preserves the backward prototypes and general development source from the same epoch.",
      "The causal routes use the root causal export descended from fp4_matmul 4590537, plus explicit release portability changes that do not alter CUDA/C++ kernels.",
      "The direct CuTe experiment is the durable b531f675 FlashAttention overlay; v510 is the separately materialized aa021504 snapshot.",
      "The 1.2B real-token source delta is materialized from fp4_matmul cd59dda under reproduction/snapshots/d64_training_cd59dda; the native D64 v416 development delta is materialized from 713819d under reproduction/snapshots/d64_v416_713819d."
    ],
    "selection_rule": "Only reference_control and release_candidate entries may be selected by a normal release recipe. Historical, comparator, operator-only, diagnostic, disabled, and preserved-unpromoted entries require an explicitly named experiment and may not be substituted by shape alone."
  },
  "status_definitions": {
    "reference_control": "Matched higher-precision control used to define the comparison boundary.",
    "release_candidate": "Explicitly authenticated by the portable adapter, but still subject to the release blockers and evidence limits listed here.",
    "historical_replay": "Claim-exact source for an earlier paper result; kept separate from the causal development tree.",
    "pinned_comparator": "Third-party implementation pinned for a matched comparison, not a local method.",
    "operator_only": "Kernel and measurement path are retained, but the portable TorchTitan training boundary is incomplete or does not admit the route.",
    "diagnostic": "Runnable only as an explicitly selected ablation or investigation; not a recommended training route.",
    "disabled_fail_closed": "Source is retained, but supported dispatch refuses the route because a correctness, liveness, numerical, or performance gate failed.",
    "preserved_unpromoted": "A complete historical experiment overlay is preserved for continuation, but it is not merged into the current route tree and lacks the evidence needed for promotion."
  },
  "routes": [
    {
      "id": "bf16_fa4_control",
      "human_name": "BF16 FA4 control",
      "internal_family": {
        "label": "FlashAttention CuTe-DSL BF16",
        "version": "flash-attention b531f675"
      },
      "phase": "control",
      "attention_mode": "causal",
      "status": "reference_control",
      "summary": "Matched causal BF16 forward and backward control. The CuTe runtime specializes the pinned implementation for the requested shape; it is not built by tools/build_fa4.py.",
      "selection": {
        "portable_build": true,
        "torchtitan_dispatch": "matched_control",
        "paper_use": "reference_control"
      },
      "shape_profiles": [
        {
          "label": "8B matched release control",
          "constraint": "Exact paper and portable-training comparison geometry; the underlying CuTe implementation supports more shapes, which are outside this catalog claim.",
          "batch": [1, 2, 4],
          "sequence": [4096],
          "query_heads": [32],
          "key_value_heads": [8],
          "head_dimension": [128]
        },
        {
          "label": "1.2B D64 matched release control",
          "constraint": "The portable D64 profile fixes B16/S4096/Hq32/Hkv8/D64; it is a distinct manifest profile from every D128 control.",
          "batch": [16],
          "sequence": [4096],
          "query_heads": [32],
          "key_value_heads": [8],
          "head_dimension": [64]
        }
      ],
      "precision": {
        "summary": "BF16 attention inputs, probabilities, outputs, and gradients.",
        "learned_projections": "BF16 in the matched control recipe.",
        "qk": "BF16",
        "pv": "BF16",
        "gradient_operands": "BF16",
        "dout": "BF16",
        "outputs": "BF16 dQ/dK/dV"
      },
      "source_paths": [
        "flash-attention/flash_attn/cute/interface.py",
        "flash-attention/flash_attn/cute/flash_fwd.py",
        "flash-attention/flash_attn/cute/flash_fwd_sm100.py",
        "flash-attention/flash_attn/cute/flash_bwd.py",
        "flash-attention/flash_attn/cute/flash_bwd_sm100.py",
        "flash-attention/flash_attn/cute/flash_bwd_preprocess.py",
        "flash-attention/flash_attn/cute/flash_bwd_postprocess.py",
        "torchtitan/experiments/fa4/fa4_attention.py"
      ],
      "build_paths": [],
      "benchmark_paths": [
        "tk_fa4/lowp_fa4_bwd/benchmark_v509_report_boundaries.py",
        "tk_fa4/lowp_fa4_bwd/benchmark_llama12b_e2e.py",
        "tk_fa4/lowp_fa4_bwd/benchmark_b16_forward_factorial.py",
        "tk_fa4/lowp_fa4_bwd/benchmark_llama12b_saturated.py"
      ],
      "test_paths": [
        "tests/unit_tests/test_fa4_reproduction.py",
        "tests/test_packed_bf16_qkv_control.py",
        "tests/test_d64_release_recipe.py"
      ],
      "abi_and_numerics": [
        "The control owns its own LSE and O*dO preprocessing; native-TK lifted statistics must not be passed to it.",
        "The isolated report comparator decodes the represented low-precision operands to BF16. It is shape-matched but does not consume byte-identical score inputs to the saved-quantized-QK backward path.",
        "Unsupported route labels and artifact mismatches must fail rather than silently select this control."
      ],
      "evidence": [
        {
          "path": "results/fp4_fa4_technical_report_v2_20260819/receipts/causal_d128_report_boundaries_20260901.json",
          "supports": "B1/S4096 causal boundary timings and the exact construction of the isolated BF16 comparator.",
          "limitations": [
            "The isolated comparator uses BF16 decodes of represented operands, not byte-identical NVFP4 score inputs."
          ]
        },
        {
          "path": "results/tk_fa4_8b_batch_scaling_20260901/e2e_batch_scaling_summary.json",
          "supports": "Single-GPU 8B B1/B2/B4 control timings used in the batch-scaling comparison.",
          "limitations": [
            "These are short performance gates, not long-horizon convergence runs."
          ]
        },
        {
          "path": "results/fp4_fa4_technical_report_v2_20260819/receipts/llama8b_b4_completed_20260903.json",
          "supports": "Completed 100,000,595,968-token matched BF16 control trajectory with 954 training, 81 validation, and 874 common post-warmup throughput rows.",
          "limitations": [
            "This is one trajectory, so it does not estimate run-to-run uncertainty.",
            "The raw hosted history and exact historical MDS shard/order identity are not public."
          ]
        },
        {
          "path": "results/native_tk_d64_ptx_adaptation_20260829/v416_llama12b_saturated_receipt_20260829.json",
          "supports": "Fixed-state packed-BF16 D64/B16 reference timing and held-out loss for the saturated v416 comparison.",
          "limitations": [
            "Twenty synthetic-token updates are a short smoke, not long-horizon convergence evidence."
          ]
        }
      ],
      "known_limits": [
        "The clean-clone GB200 build and distributed checkpoint-resume audit remain release blockers."
      ],
      "promotion_criteria": [
        "This entry remains the control. Any change to its source, precision, shape, or timing boundary requires a new matched receipt rather than promotion to a different status."
      ]
    },
    {
      "id": "direct_p_fast_nv_qk_mx_pv",
      "human_name": "Direct-P Fast (NVFP4 Q/K, MXFP4 P/V)",
      "internal_family": {
        "label": "historical HAO-derived direct probability publication",
        "version": "cfc06dad selector nvmx-fast"
      },
      "phase": "forward",
      "attention_mode": "noncausal",
      "status": "historical_replay",
      "summary": "Non-causal inference route that constructs E2M1 probability codes directly from normalized log scores, then performs MXFP4 P/V. It is the speed-oriented Direct-P policy from the earlier forward study.",
      "selection": {
        "portable_build": true,
        "torchtitan_dispatch": "not_connected",
        "paper_use": "headline_method"
      },
      "shape_profiles": [
        {
          "label": "published unified D128 grid",
          "constraint": "Exact measured (B,S,H,D) tuples are (1,256,16,128), (1,1024,24,128), (1,2048,24,128), (1,4096,24,128), (1,4096,64,128), and (1,8192,64,128); arrays below are not a Cartesian support claim.",
          "batch": [1],
          "sequence": [256, 1024, 2048, 4096, 8192],
          "query_heads": [16, 24, 64],
          "key_value_heads": [16, 24, 64],
          "head_dimension": [128]
        }
      ],
      "precision": {
        "summary": "NVFP4 Q/K and direct MXFP4 probability/value multiplication with BF16 output.",
        "qk": "NVFP4",
        "pv": "Direct E2M1 P with MXFP4 V and E8M0 block scales.",
        "outputs": "BF16"
      },
      "source_paths": [
        "reproduction/snapshots/forward_cfc06dad/tk_fa4/fp4_fa4_fwd/hao_direct_fp4pv_candidate.cu",
        "reproduction/snapshots/forward_cfc06dad/tk_fa4/fp4_fa4_fwd/hao_direct_fp4pv_config.inc",
        "reproduction/snapshots/forward_cfc06dad/tk_fa4/fp4_fa4_fwd/hao_direct_fp4pv_kernel.inc",